{
  "schemaVersion": 1,
  "generated": "2026-10-12T23:45:57Z",
  "commit": "461e7030e213c112819c68922a5ffd35f7f18fca",
  "repository": "justin-delano/PlayniteAchievements-Workshop",
  "items": [
    {
      "schemaVersion": 1,
      "id": "notifications/steamstation-5",
      "kind": "NotificationStyle",
      "name": "Steamstation 5",
      "description": "Playstation + Steam = Heaven on earth",
      "author": "Luxas",
      "ownerHash": "8a0b56d82c6786d91fd7a6b02188d94d9f8a98b551f342ff44bfc48df1d973af",
      "maintainers": [],
      "version": "1.0.1",
      "license": "CC-BY-4.0",
      "tags": [
        "steam",
        "playstation"
      ],
      "minPluginVersion": "4.0.0",
      "created": "2026-10-05",
      "updated": "2026-10-07",
      "contents": {
        "toastStyle": true,
        "frameStyle": false,
        "toastTemplate": false,
        "frameTemplate": false,
        "images": 12,
        "kindStyles": 1
      },
      "package": {
        "file": "steamstation-5-1.0.1.panotif",
        "formatKind": "PlayniteAchievements.NotificationStyle",
        "formatVersion": 3,
        "sizeBytes": 14018057,
        "sha256": "2e35d5f770eefc9b0c4a92b960fc70a603293f33a3b0d88d1e9c30923558423f",
        "release": {
          "tag": "notifications/steamstation-5",
          "url": "https://github.com/justin-delano/PlayniteAchievements-Workshop/releases/download/notifications/steamstation-5/steamstation-5-1.0.1.panotif"
        }
      },
      "preview": "preview.png",
      "cover": "cover.png",
      "readme": "README.md",
      "urls": {
        "package": "https://github.com/justin-delano/PlayniteAchievements-Workshop/releases/download/notifications/steamstation-5/steamstation-5-1.0.1.panotif",
        "preview": "https://cdn.jsdelivr.net/gh/justin-delano/PlayniteAchievements-Workshop@e600ed7e5a67b0edd4a209d3b2c5e3fcfa3c8065/notifications/steamstation-5/preview.png",
        "cover": "https://cdn.jsdelivr.net/gh/justin-delano/PlayniteAchievements-Workshop@e600ed7e5a67b0edd4a209d3b2c5e3fcfa3c8065/notifications/steamstation-5/cover.png",
        "readme": "https://cdn.jsdelivr.net/gh/justin-delano/PlayniteAchievements-Workshop@e600ed7e5a67b0edd4a209d3b2c5e3fcfa3c8065/notifications/steamstation-5/README.md",
        "folder": "https://github.com/justin-delano/PlayniteAchievements-Workshop/tree/main/notifications/steamstation-5"
      }
    },
    {
      "schemaVersion": 1,
      "id": "game-data/manual-2084000/shogun-showdown",
      "kind": "GameCustomData",
      "name": "Shogun Showdown",
      "description": "Manual achievements testing",
      "author": "jdd",
      "ownerHash": "87e218caf5884b05ff2befd5f5b3fb591e691e445a46b8152438fa3ca414d4f6",
      "maintainers": [],
      "version": "1.0.1",
      "license": "CC-BY-4.0",
      "tags": [],
      "minPluginVersion": "4.1.0",
      "created": "2026-10-05",
      "updated": "2026-10-08",
      "game": {
        "name": "Shogun Showdown",
        "platform": "PC (Windows)",
        "keys": [
          {
            "providerKey": "Manual",
            "providerPlatformKey": "Steam",
            "providerGameId": 2084000,
            "name": "Shogun Showdown",
            "platform": "PC (Windows)"
          },
          {
            "name": "Shogun Showdown",
            "platform": "PC (Windows)"
          }
        ]
      },
      "contents": {
        "achievementIcons": 0,
        "lockedIcons": 0,
        "customAchievements": 1,
        "achievementOverrides": 3,
        "categoryAssignments": 0,
        "categories": 0,
        "categoryImages": 0,
        "capstones": 1,
        "notes": 0,
        "achievementOrder": false,
        "notificationStyle": false,
        "manualLink": true,
        "imageFiles": 1
      },
      "package": {
        "file": "shogun-showdown-1.0.1.pa",
        "formatKind": "PlayniteAchievements.GameCustomData",
        "formatVersion": 8,
        "sizeBytes": 1514,
        "sha256": "ad9d4fb07693f5a5a60e431452f64a546e4eadbebadff1c83571133f397d4463",
        "release": {
          "tag": "game-data/manual-2084000/shogun-showdown",
          "url": "https://github.com/justin-delano/PlayniteAchievements-Workshop/releases/download/game-data/manual-2084000/shogun-showdown/shogun-showdown-1.0.1.pa"
        }
      },
      "preview": "preview.png",
      "cover": "cover.jpg",
      "readme": "README.md",
      "urls": {
        "package": "https://github.com/justin-delano/PlayniteAchievements-Workshop/releases/download/game-data/manual-2084000/shogun-showdown/shogun-showdown-1.0.1.pa",
        "preview": "https://cdn.jsdelivr.net/gh/justin-delano/PlayniteAchievements-Workshop@918240ff12733ed1f3f3fd6620671af00517fc71/game-data/manual-2084000/shogun-showdown/preview.png",
        "cover": "https://cdn.jsdelivr.net/gh/justin-delano/PlayniteAchievements-Workshop@918240ff12733ed1f3f3fd6620671af00517fc71/game-data/manual-2084000/shogun-showdown/cover.jpg",
        "readme": "https://cdn.jsdelivr.net/gh/justin-delano/PlayniteAchievements-Workshop@2e8794e4a0f74f2a26c9568335847d764f644731/game-data/manual-2084000/shogun-showdown/README.md",
        "folder": "https://github.com/justin-delano/PlayniteAchievements-Workshop/tree/main/game-data/manual-2084000/shogun-showdown"
      }
    },
    {
      "schemaVersion": 1,
      "id": "game-data/name-am2r-return-of-samus/am2r-another-metroid-2-remake",
      "kind": "GameCustomData",
      "name": "AM2R: Another Metroid 2 Remake",
      "description": "Custom/manual achievements for AM2R, a fanmade remake of Metroid II. Requires at least v1.4 of AM2R for the added game modes.\nMost achievement progress can be checked on the main menu through the Gallery and the stats listed on save files.",
      "author": "IggniFyre",
      "ownerHash": "7df92ceda01b3c38434d4e954fe85674d74e95eb523e3068f70cd7017c291cdd",
      "maintainers": [],
      "version": "1.0.0",
      "license": "CC-BY-4.0",
      "tags": [
        "am2r",
        "metroid-ii",
        "metroid-2"
      ],
      "minPluginVersion": "4.1.0",
      "created": "2026-10-10",
      "updated": "2026-10-10",
      "game": {
        "name": "AM2R: Return of Samus",
        "platform": "Computer",
        "keys": [
          {
            "name": "AM2R: Return of Samus",
            "platform": "Computer"
          }
        ]
      },
      "contents": {
        "achievementIcons": 0,
        "lockedIcons": 0,
        "customAchievements": 7,
        "achievementOverrides": 0,
        "categoryAssignments": 0,
        "categories": 0,
        "categoryImages": 0,
        "capstones": 1,
        "notes": 0,
        "achievementOrder": false,
        "notificationStyle": false,
        "manualLink": false,
        "imageFiles": 7
      },
      "package": {
        "file": "am2r-another-metroid-2-remake-1.0.0.pa",
        "formatKind": "PlayniteAchievements.GameCustomData",
        "formatVersion": 8,
        "sizeBytes": 433431,
        "sha256": "3cd2241c8ff11144203507cd25850ce5e215f5476467b175e192f8203fbe5ac0",
        "release": {
          "tag": "game-data/name-am2r-return-of-samus/am2r-another-metroid-2-remake",
          "url": "https://github.com/justin-delano/PlayniteAchievements-Workshop/releases/download/game-data/name-am2r-return-of-samus/am2r-another-metroid-2-remake/am2r-another-metroid-2-remake-1.0.0.pa"
        }
      },
      "preview": "preview.png",
      "cover": "cover.png",
      "readme": "README.md",
      "urls": {
        "package": "https://github.com/justin-delano/PlayniteAchievements-Workshop/releases/download/game-data/name-am2r-return-of-samus/am2r-another-metroid-2-remake/am2r-another-metroid-2-remake-1.0.0.pa",
        "preview": "https://cdn.jsdelivr.net/gh/justin-delano/PlayniteAchievements-Workshop@6867b30d7fc9492a14e72ea202d9fb35c08aa896/game-data/name-am2r-return-of-samus/am2r-another-metroid-2-remake/preview.png",
        "cover": "https://cdn.jsdelivr.net/gh/justin-delano/PlayniteAchievements-Workshop@6867b30d7fc9492a14e72ea202d9fb35c08aa896/game-data/name-am2r-return-of-samus/am2r-another-metroid-2-remake/cover.png",
        "readme": "https://cdn.jsdelivr.net/gh/justin-delano/PlayniteAchievements-Workshop@6867b30d7fc9492a14e72ea202d9fb35c08aa896/game-data/name-am2r-return-of-samus/am2r-another-metroid-2-remake/README.md",
        "folder": "https://github.com/justin-delano/PlayniteAchievements-Workshop/tree/main/game-data/name-am2r-return-of-samus/am2r-another-metroid-2-remake"
      }
    },
    {
      "schemaVersion": 1,
      "id": "game-data/name-banjo-kazooie/banjo-kazooie-recompiled",
      "kind": "GameCustomData",
      "name": "Banjo-Kazooie (Recompiled)",
      "description": "Custom/manual achievements for Banjo Recompiled, a fanmade native PC port of Banjo-Kazooie.\nAchievements designed so that achievement progress can checked through the 'View Totals' screen on the in-game pause menu.",
      "author": "IggniFyre",
      "ownerHash": "7df92ceda01b3c38434d4e954fe85674d74e95eb523e3068f70cd7017c291cdd",
      "maintainers": [],
      "version": "1.0.1",
      "license": "CC-BY-4.0",
      "tags": [
        "banjo-kazooie",
        "banjo-recompiled",
        "decompilation"
      ],
      "minPluginVersion": "4.1.0",
      "created": "2026-10-04",
      "updated": "2026-10-10",
      "game": {
        "name": "Banjo-Kazooie",
        "platform": "Computer",
        "keys": [
          {
            "name": "Banjo-Kazooie",
            "platform": "Computer"
          }
        ]
      },
      "contents": {
        "achievementIcons": 10,
        "lockedIcons": 0,
        "customAchievements": 11,
        "achievementOverrides": 5,
        "categoryAssignments": 0,
        "categories": 0,
        "categoryImages": 0,
        "capstones": 1,
        "notes": 0,
        "achievementOrder": true,
        "notificationStyle": false,
        "manualLink": false,
        "imageFiles": 16
      },
      "package": {
        "file": "banjo-kazooie-recompiled-1.0.1.pa",